{
  "$schema": "https://json-schema.org/draft/2020-12/schema",
  "$id": "mediguard/contracts/c3_event/1.0.0",
  "title": "C3 event to C4",
  "description": "Sent by C3 for every response it scans (POST /v1/events/c3). Not sent when the scan itself failed (fail-closed error), so scanner errors never count against a user.",
  "type": "object",
  "additionalProperties": false,
  "required": [
    "event_id",
    "org_id",
    "user_id",
    "request_id",
    "session_id",
    "event_timestamp",
    "c3_verdict",
    "clause_id",
    "leaked_pii_detected",
    "leaked_pii_count"
  ],
  "properties": {
    "event_id": {
      "type": "string",
      "minLength": 1,
      "maxLength": 64,
      "pattern": "^[A-Za-z0-9_.:-]+$",
      "description": "Unique per event, never reused. C4 drops duplicates. Recommended: evt-cN-<uuid4>"
    },
    "org_id": {
      "type": "string",
      "minLength": 1,
      "maxLength": 64,
      "pattern": "^[A-Za-z0-9_.:-]+$",
      "description": "Hospital id, copied from the request"
    },
    "user_id": {
      "type": "string",
      "minLength": 1,
      "maxLength": 64,
      "pattern": "^[A-Za-z0-9_.:-]+$",
      "description": "User id, copied from the request"
    },
    "request_id": {
      "type": "string",
      "minLength": 1,
      "maxLength": 64,
      "pattern": "^[A-Za-z0-9_.:-]+$",
      "description": "Request id created by the gateway, copied from the request"
    },
    "session_id": {
      "type": "string",
      "minLength": 1,
      "maxLength": 64,
      "pattern": "^[A-Za-z0-9_.:-]+$",
      "description": "Session id created by the gateway, copied from the request"
    },
    "event_timestamp": {
      "type": "string",
      "format": "date-time",
      "pattern": "^\\d{4}-\\d{2}-\\d{2}T\\d{2}:\\d{2}:\\d{2}(\\.\\d{1,6})?Z$",
      "description": "Time C3 scanned the answer"
    },
    "c3_verdict": {
      "enum": [
        "CLEAN",
        "VIOLATION"
      ]
    },
    "clause_id": {
      "type": [
        "string",
        "null"
      ],
      "maxLength": 64,
      "description": "Top cited clause. null when CLEAN, and null for a leak-only VIOLATION with no policy clause"
    },
    "leaked_pii_detected": {
      "type": "boolean"
    },
    "leaked_pii_count": {
      "type": "integer",
      "minimum": 0
    }
  },
  "allOf": [
    {
      "if": {
        "properties": {
          "c3_verdict": {
            "const": "CLEAN"
          }
        }
      },
      "then": {
        "properties": {
          "clause_id": {
            "type": "null"
          },
          "leaked_pii_detected": {
            "const": false
          },
          "leaked_pii_count": {
            "const": 0
          }
        }
      }
    },
    {
      "if": {
        "properties": {
          "leaked_pii_detected": {
            "const": true
          }
        }
      },
      "then": {
        "properties": {
          "leaked_pii_count": {
            "minimum": 1
          },
          "c3_verdict": {
            "const": "VIOLATION"
          }
        }
      }
    },
    {
      "if": {
        "properties": {
          "leaked_pii_detected": {
            "const": false
          }
        }
      },
      "then": {
        "properties": {
          "leaked_pii_count": {
            "const": 0
          }
        }
      }
    },
    {
      "if": {
        "properties": {
          "c3_verdict": {
            "const": "VIOLATION"
          },
          "leaked_pii_detected": {
            "const": false
          }
        }
      },
      "then": {
        "properties": {
          "clause_id": {
            "type": "string",
            "minLength": 1
          }
        }
      }
    }
  ]
}