{
  "event_id": "evt-c3-0001",
  "org_id": "org_001",
  "user_id": "user_001",
  "request_id": "req_20261020_000123",
  "session_id": "sess_01JAB3K9Q2",
  "event_timestamp": "2026-08-23T07:10:03Z",
  "c3_verdict": "VIOLATION",
  "clause_id": "POL-PHI-002",
  "leaked_pii_detected": true,
  "leaked_pii_count": 3
}